{
  "applicability_id": "shelf-count.2026-07",
  "captured_utc": "2026-07-12T09:02:00Z",
  "kind": "count-check",
  "receipt_id": "receipt.shelf-count.v0",
  "schema": "bvm-receipt/0.1",
  "scope": "First count of the seed cabinet, before re-shelving the bench packets.",
  "source": "RECEIPTS/data/shelf-count-v0.txt",
  "source_sha256": "6e6a81f860a322adec5db13b1a009fe15c0c0de22b60570b96654ff08c3ec54f",
  "status": "fail",
  "subject_id": "artifact.shelf-count.v1_0_0"
}
