{
  "schema": "bvm-receipt/0.1",
  "receipt_id": "receipt.executed-object.replace-me",
  "subject_id": "artifact.replace-me.v0_1_0",
  "kind": "executed-object",
  "captured_utc": "2026-07-15T12:00:00Z",
  "status": "pass",
  "scope": "State the bounded behavior checked on the canonical object.",
  "source": "RECEIPTS/data/execution-replace-me.txt",
  "source_sha256": "replace-with-lowercase-sha256",
  "object": "CANON/objects/replace-me",
  "object_sha256": "replace-with-lowercase-sha256"
}
