{
  "schema": "bvm-receipt/0.1",
  "receipt_id": "receipt.replace-me",
  "subject_id": "artifact.replace-me.v0_1_0",
  "kind": "probe",
  "captured_utc": "2026-07-15T12:00:00Z",
  "status": "observed",
  "scope": "Describe exactly what the source establishes.",
  "source": "RECEIPTS/data/replace-me.txt",
  "source_sha256": "replace-with-lowercase-sha256",
  "applicability_id": "replace-me.scope-v1"
}
