{
  "applicability_id": "adapter-parity.corpus-v2",
  "captured_utc": "2026-07-15T13:05:00Z",
  "kind": "probe",
  "receipt_id": "receipt.probe.v2",
  "schema": "bvm-receipt/0.1",
  "scope": "Four locked cases: two valid objects and two duplicate-key rejection cases.",
  "source": "RECEIPTS/data/probe-v2.txt",
  "source_sha256": "df900c31bf33a177eadb35a79f2a26095137b9e7ef91365cfa59ee9573656414",
  "status": "pass",
  "subject_id": "artifact.adapter-parity.v1_0_0"
}
