{
  "schema": "bvm-receipt/0.1",
  "receipt_id": "receipt.positive-control.replace-me",
  "subject_id": "artifact.replace-me.v0_1_0",
  "kind": "positive-control",
  "captured_utc": "2026-07-15T12:00:00Z",
  "status": "pass",
  "scope": "State the known signal or mismatch and the detection path exercised.",
  "source": "RECEIPTS/data/positive-control-replace-me.txt",
  "source_sha256": "replace-with-lowercase-sha256"
}
